author,text,likes,time,replies
@_Deepak__Verma,why he is regularly watching on his right something is suspicious,0,2024-11-07 23:18:49,0
@Oladipupo_,"For the get_random function, why do you have to turn the set into a list first?, the choice method in random will return a random value in the set anyway.

Someone correct me if in wrong",1,2024-11-07 23:18:49,0
@jadencresser,Would he have all this attitude in a real interview?,1,2024-11-07 23:18:49,0
@yashnagda9363,This is hard.. I have to use all my brain power and now i want to go to sleep.,0,2024-11-07 23:18:49,0
@vociefromtop,sets first value will automaticlly be random or am i wrong?,0,2024-11-07 23:18:50,0
@Astar337,Am i the only one who thinks this is stressful? Maybe i need more practice.,1,2024-11-07 23:18:50,0
@adityag6022,Thank you sir,0,2024-11-07 23:18:50,0
@infinitygod5379,"honestly you sound like my friend, you know? now i wanna talk to that guy",0,2024-11-07 23:18:50,0
@incantus1,lets assume i know what im doing,1,2024-11-07 23:18:50,0
@AnnieBox,Oh no!! I thought it was you to show the face!!! This is a fishing cover pic! [○･｀Д´･ ○],0,2024-11-07 23:18:50,0
@5kr0dy16,"I would’ve stopped the interview the instant he started complaining. 0 f-s about what triggers people. It’s call life, not everything’s fair.",0,2024-11-07 23:18:50,0
@jamaisnunca,This is ultra easy too me but to juniors I think it is better than algo questions though,0,2024-11-07 23:18:50,0
@harmanbaidwan1713,"11:27

wait, this doesn't work tho? 

For the insert function, he needs to use the append() function to add an element in the list (that's how its done in python). 

He's using some sort of add() function to add the element in the lust which isn't even a real thing...

also  why is bro using // to write his comments when he's doing it in python",0,2024-11-07 23:18:50,0
@Avighna,I would use coordinate compression with a segment tree lmao,0,2024-11-07 23:18:50,0
@dj1984x,"Is the person being interviewed intentionally coming off as arrogant or is this perhaps his internet funny persona? Not sure but some things he says I feel like you wouldn't say ... like ""i. don't know why you use google docs it think it's stupid but ok"" lmaooo love the honesty tho but ya i'd never say that",1,2024-11-07 23:18:50,0
@j-rrivera8800,do you really need to explain bit by bit the program while doing it ? shit that is so much pressure a beginner to watch like me. I can't even  do that.,0,2024-11-07 23:18:50,0
@omarllama,"Bro is a little bit carcissistic, thinking he's the smartest guy in the room while strugling to delete with a swap. It would be a no hire from me.",1,2024-11-07 23:18:50,0
@wtcxdm,4:53 way too honest,1,2024-11-07 23:18:50,0
@abhicasm9237,so did he get the job in bloomberg?,0,2024-11-07 23:18:50,0
@criostasis,If he wouldve been like can I code this in Assembly  wouldve been epic,0,2024-11-07 23:18:50,0
@lawniczakjohn,All my homies hate Citadel; criminal organization.,1,2024-11-07 23:18:50,0
@zhuhw,"""Google Coding Interview with a Meta Intern""
Ask him DP question!",0,2024-11-07 23:18:50,0
@kgstories405,"You didn’t import random, so u would have failed",0,2024-11-07 23:18:50,0
@ishdemon_,His whole game is throw hashmap at the problem & the interviewer..wonder how neetcode dodged those,0,2024-11-07 23:18:50,0
@pseudounknow5559,Can yo udo more of this please,0,2024-11-07 23:18:50,0
@carlosduque5174,Two of my biggest heroes in a single video. This is even better than anything the MCU has dared to do lol.,2,2024-11-07 23:18:50,0
@sivakumar.s2559,We can use sets,0,2024-11-07 23:18:50,0
@MProtik,"i have a question.

do i need a set if i can make sure that my list has no duplicate..??
it is basically just a list with no duplicate

love from Bangladesh",0,2024-11-07 23:18:50,0
@jayneversettle,Prove me wrong: NeetCode is Illuminati who doesn't reveal himself.,0,2024-11-07 23:18:50,0
@DaveThomson,"So  .iterator().next() didn't work, what version of python was this, 2.7? 

I had to go with index = next(iter(self.map[value]))",0,2024-11-07 23:18:50,0
@art4eigen93,"But do you know how to check if a given string is a palindrome?
:p




P.S. Collab that everyone deserves.",3,2024-11-07 23:18:50,0
@obiwankenobi288,"I have a google interview next week, i'm doomed bro",1,2024-11-07 23:18:50,0
@milanthakkar9493,boyalgo and neetcode collab anytime soon? ;)),0,2024-11-07 23:18:50,0
@mutyaluamballa,"Using random.choice on a list with duplicate elements will not result in elements with equal probability, right?? 42:00",0,2024-11-07 23:18:50,0
@SLowe-xi3fq,"whenever i see no duplicates, im thinking use a set",0,2024-11-07 23:18:50,0
@atailihave4506,Thanks!,0,2024-11-07 23:18:51,0
@Nonchalant2023,First 2 minutes and he would get a NH for not being Googley. Googlers will understand :),0,2024-11-07 23:18:51,0
@woeuntous,i think delete function easily can be done with try except. why did he make it so complicated? did i miss something?,0,2024-11-07 23:18:51,0
@deep.space.12,Curious: I always thought of coding interviews to be C-styled (pointers and stuff). Are we allowed to use built-in features for coding interviews? The insert() and remove() functions are basically wrappers over an existing class Set. Might as well extend it and add a getRandom() function...,10,2024-11-07 23:18:51,0
@sybaseguru,"Bizzarre discussions for anything other than trivial data. B-tree type structures allow rapid access to random elements,  easy delete and insert. I wouldnt employ him as he dives straight into coding, rather than thinking of the algorithm and its trade-offs.",0,2024-11-07 23:18:51,0
@tzuilee588,lmao collaborating with Pan!!!,0,2024-11-07 23:18:51,0
@_IMNNO,Sometimes I feel like the only Hispanic that watches these videos.,1,2024-11-07 23:18:51,0
@chito510_,Lmao this guy is hella funny,5,2024-11-07 23:18:51,0
@richardokonicha,his score multiplied by zero for his bad manners,0,2024-11-07 23:18:51,0
@kassimolawale4223,The first one is linked list right,0,2024-11-07 23:18:51,0
@ranjithragul,"46:04 @Neetcode here you shown typical Indian character, I knew almost 75% sure you are an Indian when this video aired.",0,2024-11-07 23:18:51,0
@hxsuhsbshdudgvd,Qualified for Meta？can't imagine how easy it is in previous job market,0,2024-11-07 23:18:51,0
@VikalpShukla-y6y,Half of the time from his face it feels like he is trolling.,0,2024-11-07 23:18:51,0
@tuskiomisham,Get a value with equal probability? just have a round-robin counter :),0,2024-11-07 23:18:51,0
@chilly2171,you don't need to go through the whole least to get a random index omg,0,2024-11-07 23:18:51,0
@aazzrwadrf,clever solution!,0,2024-11-07 23:18:51,0
@numberjuan297,Do another one !,0,2024-11-07 23:18:51,0
@TanjidHossainAmran,Can i use HashSet??,0,2024-11-07 23:18:51,0
@peeper2070,Idk if this is satire or not but it’s quite funny assuming it’s a joke tbh,0,2024-11-07 23:18:51,0
@jimmyding335,"The kid is so hyped up and just went all the way up in your face...... He's not taking this seriously enough to actually be a ""proper mock interview"". He's definitely smart, but he's a bit annoying/insecure......?",0,2024-11-07 23:18:51,0
@yizzy3782,"13:00 cant we just use random.randint(0,len(self.map) and use it as an index to return a random value?",7,2024-11-07 23:18:51,0
@ganzorig5136,korean guy have his own youtube channel ?,0,2024-11-07 23:18:51,0
@IlyesCodes,First 5 mins felt like they switched positions and neetcode is subject to stupid questions,1,2024-11-07 23:18:51,0
@posthocprior,"Not hard. Not easy. The guy doing the interview is unbearably annoying. (I did it in about ten minutes, with pseudocode.)",0,2024-11-07 23:18:51,0
@himalczyk258,"Is this interview for a L3 level ?

Or is this for intern at google?

I'm just wondering, because this question in the pool of all the others, would be just too perfect to get.",2,2024-11-07 23:18:51,0
@jacobnicotra,The autocapitalization,2,2024-11-07 23:18:51,0
@plurisdesign3210,"This is staged, if someone is a beginner here, this is not the train of thoughts you need to follow. The tested guy is not a beginner by any stretch of the imagination. Now; don't get me wrong it is good, realistic and mind shaping but it was staged in a poorly manner. They can simply acknowledge their actual coding level and try to guide viewers in a manner they would have something to learn, otherwise is just theatrics",0,2024-11-07 23:18:51,0
@andreasl.1714,"if you have these values inside an array, could you just get a random number from 0 to array.length and call it a day? (i dont know what is ""equal probability"" and if im missing this point with my solution)",0,2024-11-07 23:18:51,0
@blang1,So I'm 6 minutes in and know that I have no clue what this dude is talking about in terms of equal probability yet know that I could totally hammer out the rest of the class and generate random numbers.  I wonder if the equal probability part would tank me.,0,2024-11-07 23:18:51,0
@mj-lc9db,"Lol this is where java/C#/C++ wins, if i do this in python id be confused also",2,2024-11-07 23:18:52,0
@gamemoves2415,A class only has methods not functions though,1,2024-11-07 23:18:52,0
@infinitygod5379,"well well well, what do we have here? neetcode now socializing?",0,2024-11-07 23:18:52,0
@ivanjuarez6505,I’m a cs major but I feel like it won’t cut it when I graduate. I want to learn more. Can someone recommend websites to learn from? Thank you,0,2024-11-07 23:18:52,0
@sadboi3002,"HashMap!
That's my brother",0,2024-11-07 23:18:52,0
@TheAxeForgetsTheTreeRemembers,In 3 minutes he already raised enough red flags that I would not hire him whatever his skills.,18,2024-11-07 23:18:52,0
@eneskursadyasar5393,"So you can say to a interviewer ""Let me ask you a question?"". It's funny go next.",0,2024-11-07 23:18:52,0
@anzcnam6680,Do I need DSA if I want to be a web developer,0,2024-11-07 23:18:52,0
@zhouwang2123,33:03:  collections dot defaultd..k??? I may have my bad listening...,0,2024-11-07 23:18:52,0
@screamour,33:19 is me when I don't know what I'm doing,0,2024-11-07 23:18:52,0
@jonelbarrientos7057,it looks like hes the interviewer in 4:00,2,2024-11-07 23:18:52,0
@shivanshsood6611,why is he making that GigaChad face again and again,0,2024-11-07 23:18:52,0
@Nk_Lifestyle1,"Lol, as soon as i see frying , I had to click this video",0,2024-11-07 23:18:52,0
@binayakpurohit,"But he cheated tho and used improper language and his body language told us he is not serious at all, those are kind of thing you get rejected for",0,2024-11-07 23:18:52,0
@AnandKumar-kz3ls,bro i'm here to see your face,1,2024-11-07 23:18:52,0
@haseebqureshi2291,"Interviewer : Ok, one last question ?
He : 42:14",0,2024-11-07 23:18:52,0
@yli8888,What’s the white thing in Pen’s nose? I hope his real world interviewers did not see this episode -,0,2024-11-07 23:18:52,0
@ivyho3234,17:51 the way he high-fived himself,0,2024-11-07 23:18:52,0
@АлександрКрестинский-м5д,"Hi, your video about algoritms it's realy box with useful information. Require or not CS or math degree from a top university in America or Europe for hire up in google? Or it's possible for everyone who from poor country and finished regular college and learn algoritms? I'm from Kazakstan and i finished regular college after college i got a job  and now i work in IT but my sallary suck. I study english and doing pet projects. Now i decided dive deep into the algoritms and computer scines. What's your degree? If it's not a secret.",0,2024-11-07 23:18:52,0
@sandipkadam8622,"I ask the same question to ChatGpt, it gives me code with in 10 second",0,2024-11-07 23:18:52,0
@lukecronquist6003,Dunno why he'd want to actively become a psychopath working for 'meta' but ok,0,2024-11-07 23:18:52,0
@chhavijoshi5778,Hello sir. Hero is giving jobs and internships through  Hero Campus Challenge (Season 8). Please tell us details about that also sir in a video.,0,2024-11-07 23:18:52,0
@thecunningcreator6679,Wait this is the pear ai dude,0,2024-11-07 23:18:52,0
@YT.Nikolay,"Wooow, nice!",0,2024-11-07 23:18:52,0
@parshuram3272,yes but logic matters  i think,0,2024-11-07 23:18:52,0
@metax73,"I'm assuming it's just for entertainment here, but the sassiness in an actual interview would definitely be a no hire. A huge part of the interview is figuring out if you're someone they would like to work with. Humor is a huge plus, but complaining about google docs and saying ""I already knew that"" to a hint when it sounded like you didn't, would be an instant no.",4,2024-11-07 23:18:52,0
@AnonYmous-yu6hv,why does he talk so slowly and emphasising words like that?,0,2024-11-07 23:18:52,0
@NitinSinghMinVlogs,are all meta dev asian?,0,2024-11-07 23:18:52,0
@littleboy8141,This is clearly a no-hire. the coding speed is very slow not really professional . There are too many basic question was asked which was very static and acting seems as TC already knows the question before. This is a no-hire with my opinion.( as a Meta interviewer),0,2024-11-07 23:18:52,0
@eugenekukhol7552,doesn't the hashmap(set) have an array under the hood? :D,0,2024-11-07 23:18:52,0
@kenkar-oi7ms,"Is this consider ""Easy""  type question",0,2024-11-07 23:18:52,0
@skyacaniadev2229,"In a real interview, can I actually have 45 minutes just on this question?",0,2024-11-07 23:18:53,0
@redcraft612,"7:06 8:08 It's a dictionary, not a hashmap.",0,2024-11-07 23:18:53,0
@DaveThomson,Ouch on the Citadel comment,0,2024-11-07 23:18:53,0
@sproutboot,Why is he speaking like that,1,2024-11-07 23:18:53,0
@ebrobaaood7691,What is the point from updating the last element in the array? i mean it will be deleted anyway,0,2024-11-07 23:18:53,0
@grozoff,I tried to scroll down the code several times while watching this video,0,2024-11-07 23:18:53,0
@mikebolton2342,Technical interviews have become kind of stupid.,0,2024-11-07 23:18:53,0
@kafychannel,nice good job,1,2024-11-07 23:18:53,0
@niti_n_n_itin,LET ME ASK YOU A QUESTION,0,2024-11-07 23:18:53,0
@JoshSmith-sr6ks,lol player man here is such a g,0,2024-11-07 23:18:53,0
@muhammadbaqir3545,hey! NeetCode if there are duplicates isn't our demand of getting uniform number be disturbed? like for 2 duplicates of the same number the probability of that number would be twice. or is it what was intended?,0,2024-11-07 23:18:53,0
@supremoluminary,"can it work to use random.randint(0, set.size) ?",0,2024-11-07 23:18:53,0
@manav____,another fluid kid,1,2024-11-07 23:18:53,0
@eagleeggs3862,"Inclusive , ocd , give me what I want wah",0,2024-11-07 23:18:53,0
@codelinx,The auto caps would distract the hell out of me it was annoying as you are typing.,0,2024-11-07 23:18:53,0
@benjaminacosta4947,29:24 i dont know much of programming but this code breaks so badly,0,2024-11-07 23:18:53,0
@atlasanomalous202,So is it ok to whine and drop the f bomb during an interview? Maybe attitude is what I have been missing all along.,0,2024-11-07 23:18:53,0
@facundolubo,"Couldn't be something like this?:

from random import randrange

class Myclass():
    def __init__(self):
        self.__my_set = set()
        self.__my_list = []  # Initialize my_list as an empty list
        self.__length = 0
        self.__altered = False
        
    def add(self, value: int) -> None:
        self.__my_set.add(value)
        self.__altered = True
    
    def remove(self, value: int) -> None:
        self.__my_set.discard(value)
        self.__altered = True

    @staticmethod
    def calc_len(my_set):
        return len(my_set)
    
    @staticmethod
    def create_list(my_set):
        return list(my_set)
        
    def get_random(self) -> int:
        if not self.__altered and self.__length == 0:  # Check if length is 0 to avoid 
            return None
        elif self.__altered:
            self.__length = self.calc_len(self.__my_set)
            self.__my_list = self.create_list(self.__my_set)
            return self.__my_list[randrange(self.__length)]
        else:
            return self.__my_list[randrange(self.__length)]",0,2024-11-07 23:18:53,0
@kartheekpawar7580,I was getting ocd for the capitals too,0,2024-11-07 23:18:53,0
@r.macedo3612,"13:19

Just find a random index...",0,2024-11-07 23:18:53,0
@b3arwithm3,This guy looks like a pita to work with.,0,2024-11-07 23:18:53,0
@gingeri-d7l,is this real or stage?,0,2024-11-07 23:18:53,0
@amosemanuelciocan2524,you can assume,0,2024-11-07 23:18:53,0
@venkatasivavarmasirivuri231,Is he using any other side thing for coding he is always watching side,0,2024-11-07 23:18:53,0
@kashishkavi8416,"""i bet you didn't know that""",0,2024-11-07 23:18:53,0
@jollymusiq,do you know that the person who told you said that if any prophet says what she does in secret that prophet,0,2024-11-07 23:18:53,0
@anshumansharma2251,"Is it me or someone else too, that find pan's behaviour somehow rude?",0,2024-11-07 23:18:53,0
@ShravankumarKarike,there is always a smart asian even if you are asian,0,2024-11-07 23:18:53,0
@PavelRepin-qd1cc,"I thought that last question would be ""Should this code support multithreading?"" but then I realised it's intern interview",0,2024-11-07 23:18:53,0
@chrisii3,this guy is the goat,0,2024-11-07 23:18:53,0
@rodrigosimoes185,you jumped MeetCode,0,2024-11-07 23:18:54,0
@uncle_bob6698,What is this middle school theatrics?,0,2024-11-07 23:18:54,0
@JAIMEAYMERICHFANS,"I don't like the kids attitude, he sounds to cocky",0,2024-11-07 23:18:54,0
@ashwinnema06,@Neetcode Why don't you show your face?,0,2024-11-07 23:18:54,0
@choubro2,bro sounds so sarcastic lol,1,2024-11-07 23:18:54,0
@АлекСневар,"“Stupid to write code in google doc”, “I have an OCD” - that’s it, not hired, despite the fact how brilliant you solve the peoblem",1,2024-11-07 23:18:54,0
@dampdigits,This guy is hilarious,0,2024-11-07 23:18:54,0
@TheAudaciousNomad,I have OCD and it's pissing me off,0,2024-11-07 23:18:54,0
@mummafier,Dude is hilarious,0,2024-11-07 23:18:54,0
@javaspringdev,Can anyone tell Java random method?,0,2024-11-07 23:18:54,0
@user-shruti-raj,Someone tell him that his camera is on  7:53,0,2024-11-07 23:18:54,0
@nathangwyn6098,"He comes off a littttle arrogant but I would of started with a hash map myself 

***finished the video.

My thoughts are you know your shit better than the average dev, but try to come off less arrogant.. like you were talking down to your interviewee... that's a no no. They are testing your problem solving skills most of all BUTTTT your personality can overshadow all that.",0,2024-11-07 23:18:54,0
@miscreatedmonster2.022,Why this kid trolling so hard lol,0,2024-11-07 23:18:54,0
@LuisMorales-yx8di,"this is bloomberg tag question, like bro . if he's serious into bloomberg he already knows the answer. you were too easy on him neetcode",1,2024-11-07 23:18:54,0
@vininho,"Well, I'm a L5 in a big tech (saying it just cause I know a lot of ppl here would try to discredit me, been a L5 in a big tech doesnt say much either way), and I will just comment what I think about this mock interview, I will watch and pause the write this.

 - says EXACTLY whats written... but thats ok, time to think in the problem. Hope its not just a script about interviews.
 - Good question
 - Great question
-- where are the other questions about the problem? So much things that he could have asked and that he wont know what to do when coding... as to what if getRandom is called with no inserts? 
 - WHAT? If you dont know why, you should not assume it is stupid... And saying that is VERY RUDE
 - The interviwer didnt even respond to that cause for real... that would be already enough for me to consider his attitude VERY negative. Even though it probably is very unconfortable for him, he should not blame the interviwer, he should just explain and try to find a better way together.
 - The right complexity, but a wrong think process, he was thinking that random.choice was O(n), and its explained right after when he is explained that its O(n) cause of the list transformation
 - What is he doing? hahahahahaha, Funny as f***. Such a contortionism to do something so simple. If the value is gonna be removed, why is he changing it to the last position hahahahaha, its gonna be removed, so it does not matter whats in the last position. But that is fine, I would not remove any points for that, but I would tell him to make that less confuse.
 - CREEPPYYYYY (nothing to remove points of course)
 - Please dont say that kind of thing, you don't know who's on the other side. He was rude about google docs and having OCD, wich is a real problem and that could be addressed during the interview normally. And now just swears like that... it could be a problem for the interviewer too and he didnt care, very impolite. 
 - Okay... he is not taking it seriouslly.
 - Thats the question... you can see now that the interviewer was very unconfortable with the way he was talking, and continued to be VERY POLITE. Congrats to the interviwer.


Well, the interviwer was amazing in handling the interview and giving his feedback. Even when saying about the bad points he was very polite.  I REALLY DONT THINK HE WOULD GIVE A HIRE TO HIM HAHAHAHAHAHA, and ROASTED him right after cause of his bad attitude.

Hard skills - Average (the question was very EASY, and the answer was a good one, after the allowing repeated numbers it was really a bad approach but the interviwer didnt want to complicate things for him)",2,2024-11-07 23:18:54,0
@petervyx95,This quite easy but this Korean need too much time to solve it,0,2024-11-07 23:18:54,0
@economicblast,bro said segregate,0,2024-11-07 23:18:54,0
@sadiqabubakar7185,Just use a hash set goddamn it,1,2024-11-07 23:18:54,0
@crimmerz2000,Idk y this guy is funny to me,0,2024-11-07 23:18:54,0
@millionare5446,why couldnt he use randint() to get a random index from the set of values using the length of it?,1,2024-11-07 23:18:54,0
@jayleejw1801,This is a pretty easy question lol,1,2024-11-07 23:18:54,0
@MinhPham-eh6lr,Fryingpan is so funny ngl,0,2024-11-07 23:18:54,0
@SturdyNoodle,this guy is hilarious,0,2024-11-07 23:18:54,0
@htproduction9923,"If value in self.map: 
(This is not constant time right) it’s o(n)",0,2024-11-07 23:18:54,0
@Djamieson713,he's already practiced this stupid question,0,2024-11-07 23:18:54,0
@sunnyboi1221,Haha now we know why this guy is a YouTuber and will eventually quit his job to become a full time YouTuber.,0,2024-11-07 23:18:54,0
@varuncanhandle,Finally found it. just here to make sense of why this was removed,0,2024-11-07 23:18:54,0
@DeGoya,face reveal please,0,2024-11-07 23:18:54,0
@aniketraj_0520,What about the body movements and reactions like clapping and screaming ohhhh... are those good in actual interview??,1,2024-11-07 23:18:54,0
@TheNitroPython,This guy gets a little sassy lol,1,2024-11-07 23:18:55,0
,W,0,2024-11-07 23:18:55,0
@kevintran7340,"hehe from the first 5 minutes, if you're kind of a dick to the interviewer, you're not gonna get the job",0,2024-11-07 23:18:55,0
@surajkumardwivedi7139,"2 hashmaps would have solved this beautifully, no need for array",0,2024-11-07 23:18:55,0
@EmbddedJiuSage,42:15 is the best moment,0,2024-11-07 23:18:55,0
@arod209,"@NeetCode
At the lightbulb moment timestamp, I'm not sure why you'd have to move the value to the end of the array to keep the constant time removal. If you were keeping a hashmap where the key is the integer and the value is the index then why couldn't you just use array.pop() and give it a specified index? Wouldn't that be O(1) since you're specifying an index or is that not truly O(1) in the internals of an array?",1,2024-11-07 23:18:55,0
@RentChizuruMizuhara,My immediate thought after reading the problem was to use a red black tree that doesn't allow duplicate insertions. Since the upper bound on insertions and deletions is O(logn). with a regular BST we would have to worry about balancing it.,0,2024-11-07 23:18:55,0
@ricky1wdv1,Def  not getting hired with that attitude.,4,2024-11-07 23:18:55,0
@aayushacharya935,33:19 bro lagged in O(n),0,2024-11-07 23:18:55,0
@paradox7806,"This guy is so full of himself, it’s disgusting.",0,2024-11-07 23:18:55,0
@justinmoore2034,42:26 lmaoooooooo,0,2024-11-07 23:18:55,0
@parsashiri1743,Bro I’m 15 and a finished the code for your question the moment the dude finished asking his questions,0,2024-11-07 23:18:55,0
@vaizex_osu,big fan,0,2024-11-07 23:18:55,0
@kevintran6102,this guy is hilarious :)),0,2024-11-07 23:18:55,0
@tylerd5924,Why is bro trynna rizz up,0,2024-11-07 23:18:55,0
@IamAWESOME3980,why the fck is google interview done on a google doc?,0,2024-11-07 23:18:55,0
@gopikrishna679,Let me just think about this for 5 seconds. Who tells that . Wtf,0,2024-11-07 23:18:55,0
@goshochernii,If this guy continues with this attitude he gonna get beaten somewhere from someone which isnt as nice as neetcode,0,2024-11-07 23:18:55,0
@sig7813,"All seem ok, but his behavior and swearing is a big solid NO in my opinion. Especially not understanding what was wrong with the talking. With better self-control he could do much much better.",2,2024-11-07 23:18:55,0
@patientson,"0, 1, many - edge cases",0,2024-11-07 23:18:55,0
@madhav3444,This is gonna fun; for one of us,0,2024-11-07 23:18:55,0
@AniketSomwanshi-ll7mz,W collab,0,2024-11-07 23:18:55,0
@rajchinagundi7498,"Shouldn't this be easy af ""
import random as rand

class ds:
    def __init__(self):
        self.d=set()

    def insert(self,x):
        self.d.add(x)

    def remove(self,x):
        if x in self.d:
            self.d.remove(x)
        else:
            print(""no such value prsent"")

    def getRandom(self):
        dl=list(self.d)
        if dl:
            print(dl[rand.randint(0,len(dl)-1)])
        else:
            print(""set empty"")

d=ds()
d.insert(5)
d.insert(6)
d.insert(12)
d.remove(5)
d.getRandom()"" I mean this is a piece of cake for indians",1,2024-11-07 23:18:55,0
@Yanaaaaaaaaaaaaaaaaaaaa,Frying pan is tooo funnyyy,0,2024-11-07 23:18:55,0
@ZiaBakhteyari,Nice,0,2024-11-07 23:18:55,0
